{
  "version": 2,
  "nombre": "Synthetic insurer",
  "sector": "insurance",
  "plataforma": "jira",
  "mapeoEstados": {
    "Tareas por hacer": "pendiente",
    "En curso": "en_curso",
    "En revisión": "en_revision",
    "Bloqueado": "bloqueado",
    "Listo": "terminado"
  },
  "equipos": {
    "campo": "componentes",
    "lista": [
      {
        "id": "sin",
        "nombre": "Claims",
        "tipo": "interno",
        "proveedor": null,
        "area": "Business",
        "usa_sprints": true,
        "fte": [
          {
            "periodo": "2026-09",
            "valor": 6,
            "origen": "declarado"
          }
        ],
        "limites": {}
      },
      {
        "id": "pol",
        "nombre": "Policies",
        "tipo": "interno",
        "proveedor": null,
        "area": "Business",
        "usa_sprints": true,
        "fte": [
          {
            "periodo": "2026-09",
            "valor": 5,
            "origen": "declarado"
          }
        ],
        "limites": {}
      },
      {
        "id": "can",
        "nombre": "Digital Channel",
        "tipo": "proveedor",
        "proveedor": "Vendor East",
        "area": "Channels",
        "usa_sprints": true,
        "fte": [
          {
            "periodo": "2026-09",
            "valor": 7,
            "origen": "contrato"
          }
        ],
        "limites": {}
      },
      {
        "id": "int",
        "nombre": "Integrations",
        "tipo": "proveedor",
        "proveedor": "Vendor West",
        "area": "Platform",
        "usa_sprints": false,
        "fte": [
          {
            "periodo": "2026-09",
            "valor": 4,
            "origen": "contrato"
          }
        ],
        "limites": {}
      },
      {
        "id": "dat",
        "nombre": "Data and BI",
        "tipo": "interno",
        "proveedor": null,
        "area": "Platform",
        "usa_sprints": true,
        "fte": [
          {
            "periodo": "2026-09",
            "valor": 4,
            "origen": "declarado"
          }
        ],
        "limites": {}
      }
    ]
  },
  "objetivos": [
    "tardamos",
    "arreglos",
    "comparar",
    "agentes",
    "datos"
  ],
  "medidas": [
    "ciclo",
    "retrabajo",
    "espera",
    "entregas",
    "agent_readiness"
  ]
}
