{
  "version": 2,
  "nombre": "Cliente sintético con fallos",
  "sector": "banca",
  "plataforma": "jira",
  "mapeoEstados": {
    "To Do": "pendiente",
    "In Progress": "en_curso",
    "In Review": "en_revision",
    "Blocked": "bloqueado",
    "Done": "terminado"
  },
  "equipos": {
    "campo": "equipo",
    "lista": [
      {
        "id": "pag",
        "nombre": "Pagos",
        "tipo": "interno",
        "proveedor": null,
        "area": "Canales digitales",
        "usa_sprints": true,
        "fte": [
          {
            "periodo": "2026-09",
            "valor": 5,
            "origen": "declarado"
          }
        ],
        "limites": {}
      },
      {
        "id": "rie",
        "nombre": "Riesgos",
        "tipo": "interno",
        "proveedor": null,
        "area": "Plataforma",
        "usa_sprints": true,
        "fte": [
          {
            "periodo": "2026-09",
            "valor": 5,
            "origen": "declarado"
          }
        ],
        "limites": {}
      },
      {
        "id": "app",
        "nombre": "App móvil",
        "tipo": "proveedor",
        "proveedor": "Proveedor Norte",
        "area": "Canales digitales",
        "usa_sprints": true,
        "fte": [
          {
            "periodo": "2026-09",
            "valor": 5,
            "origen": "contrato"
          }
        ],
        "limites": {}
      },
      {
        "id": "por",
        "nombre": "Portal clientes",
        "tipo": "proveedor",
        "proveedor": "Proveedor Sur",
        "area": "Plataforma",
        "usa_sprints": true,
        "fte": [
          {
            "periodo": "2026-09",
            "valor": 5,
            "origen": "contrato"
          }
        ],
        "limites": {}
      },
      {
        "id": "dat",
        "nombre": "Datos",
        "tipo": "interno",
        "proveedor": null,
        "area": "Plataforma",
        "usa_sprints": true,
        "fte": [
          {
            "periodo": "2026-09",
            "valor": 4,
            "origen": "declarado"
          }
        ],
        "limites": {}
      }
    ]
  },
  "objetivos": [
    "tardamos",
    "arreglos",
    "comparar",
    "agentes",
    "datos"
  ],
  "medidas": [
    "ciclo",
    "retrabajo",
    "espera",
    "entregas",
    "agent_readiness"
  ]
}
